{
  "schema": "plinth.consent_history/1",
  "count_line": "3 parties can reach you",
  "rule_line": "Your number is never shared without your tap.",
  "items": [
    {
      "ref": "C-1018-11",
      "granted_on": "2026-10-18",
      "party": "Northfield Estates site office",
      "detail": "Aurelia visit Sat 24 Oct, 11 am, code 4821",
      "purpose": "visit_share",
      "purpose_line": "Give a site office your first name, the visit time and only the questions you chose to send ahead, with a relay instead of your number.",
      "channel": "web",
      "notice_version": "Privacy notice v1.0, 1 Oct 2026",
      "status": "active",
      "status_line": "First name and a relay, not your number",
      "number_shared": false,
      "access_until": null,
      "ended_on": null,
      "withdrawn_at": null,
      "can_withdraw": true,
      "relay": {
        "relay_id": "db21720c-ebb7-5578-a2ab-457ff4cb7ce8",
        "open": true,
        "closes_on": null,
        "counts_toward_cap": false
      }
    },
    {
      "ref": "C-1015-02",
      "granted_on": "2026-10-15",
      "party": "Meridian Habitat site office",
      "detail": "Sapphire Grove Ph 1 site visit",
      "purpose": "number_share",
      "purpose_line": "Share your phone number with one party, by your own tap. At most 3 parties in any 30 days.",
      "channel": "web",
      "notice_version": "Privacy notice v1.0, 1 Oct 2026",
      "status": "active",
      "status_line": "Number shared, until 14 Nov 2026",
      "number_shared": true,
      "access_until": "2026-11-14",
      "ended_on": null,
      "withdrawn_at": null,
      "can_withdraw": true,
      "relay": null
    },
    {
      "ref": "C-1012-05",
      "granted_on": "2026-10-12",
      "party": "Larkspur Realty",
      "detail": "Your agent of record for Kestrel Park (you added them; shared by your tap after the visit)",
      "purpose": "number_share",
      "purpose_line": "Share your phone number with one party, by your own tap. At most 3 parties in any 30 days.",
      "channel": "web",
      "notice_version": "Privacy notice v1.0, 1 Oct 2026",
      "status": "active",
      "status_line": "Number shared by your tap",
      "number_shared": true,
      "access_until": null,
      "ended_on": null,
      "withdrawn_at": null,
      "can_withdraw": true,
      "relay": null
    },
    {
      "ref": "C-1012-04",
      "granted_on": "2026-10-12",
      "party": "Orbis Land site office",
      "detail": "Kestrel Park site visit",
      "purpose": "number_share",
      "purpose_line": "Share your phone number with one party, by your own tap. At most 3 parties in any 30 days.",
      "channel": "web",
      "notice_version": "Privacy notice v1.0, 1 Oct 2026",
      "status": "active",
      "status_line": "Number shared, until 11 Nov 2026",
      "number_shared": true,
      "access_until": "2026-11-11",
      "ended_on": null,
      "withdrawn_at": null,
      "can_withdraw": true,
      "relay": null
    },
    {
      "ref": "C-0902-01",
      "granted_on": "2026-09-02",
      "party": "Meridian Habitat sales office",
      "detail": "Price list",
      "purpose": "number_share",
      "purpose_line": "Share your phone number with one party, by your own tap. At most 3 parties in any 30 days.",
      "channel": "web",
      "notice_version": "Privacy notice v1.0, 1 Oct 2026",
      "status": "ended",
      "status_line": "Ended 2 Oct 2026",
      "number_shared": false,
      "access_until": null,
      "ended_on": "2026-10-02",
      "withdrawn_at": null,
      "can_withdraw": true,
      "relay": null
    }
  ]
}
